{
  "$schema": "../../schemas/json/docker-bake.json",
  "function": {
    "increment": {
      "params": ["number"],
      "result": "${number+1}"
    }
  },
  "group": {
    "default": {
      "targets": ["webapp-dev"]
    }
  },
  "target": {
    "webapp-dev": {
      "annotations": ["com.example.key1=value1", "com.example.key2=value2"],
      "args": {
        "buildino": "${increment(123)}"
      },
      "attest": ["type=sbom"],
      "dockerfile": "Dockerfile.webapp",
      "tags": ["docker.io/username/webapp:latest"]
    }
  },
  "variable": {
    "TAG": {
      "default": "latest"
    }
  }
}
